{
  "$schema": "https://json-schema.org/draft/2020-12/schema",
  "title": "SpecBound iteration-QC v1",
  "type": "object",
  "additionalProperties": false,
  "required": [
    "schema_version",
    "micro_spec",
    "selected_acceptance_criteria",
    "verification",
    "verdict",
    "remaining_acceptance_criteria"
  ],
  "properties": {
    "schema_version": {"const": 1},
    "micro_spec": {
      "type": "object",
      "additionalProperties": false,
      "required": ["path", "id", "sha256"],
      "properties": {
        "path": {"type": "string", "pattern": "^\\.specbound/micro-specs/req-[0-9]+/ms-[0-9]+-0*[1-9][0-9]*\\.md$"},
        "id": {"type": "string", "pattern": "^ms-[0-9]+-0*[1-9][0-9]*$"},
        "sha256": {"type": "string", "pattern": "^[a-f0-9]{64}$"}
      }
    },
    "selected_acceptance_criteria": {
      "type": "array",
      "minItems": 1,
      "uniqueItems": true,
      "items": {"type": "string", "pattern": "^AC-[0-9]+$"}
    },
    "verification": {
      "type": "array",
      "minItems": 1,
      "items": {
        "type": "object",
        "additionalProperties": false,
        "required": ["command", "result", "exit_code"],
        "properties": {
          "command": {"type": "string", "minLength": 1},
          "result": {"enum": ["passed", "failed"]},
          "exit_code": {"type": "integer"}
        }
      }
    },
    "verdict": {"enum": ["verified", "rework", "blocked"]},
    "remaining_acceptance_criteria": {
      "type": "array",
      "uniqueItems": true,
      "items": {"type": "string", "pattern": "^AC-[0-9]+$"}
    }
  }
}
