{
  "schema_version": 1,
  "micro_spec": {
    "path": ".specbound/micro-specs/req-9007/ms-9007-001.md",
    "id": "ms-9007-001",
    "sha256": "6b5a9676b2dcced35185467f195e65dfd7e1a19a87822a899100d7ac0cb50efc"
  },
  "selected_acceptance_criteria": [
    "AC-001"
  ],
  "remaining_acceptance_criteria": [],
  "verification": [
    {
      "command": "pytest -q",
      "result": "passed",
      "exit_code": 0
    }
  ],
  "verdict": "verified"
}
